{
  "bundle_count": 4,
  "entries": [
    {
      "compatibility_posture": "compatible",
      "execution_mode": "live",
      "export_id": "exp_3d6a094cab6059d8",
      "manifest_filename": "slice_07_export_manifest_rcpt_8a3e24f3de7506b1.json",
      "manifest_path": "harness/exports/slice_07_export_manifest_rcpt_8a3e24f3de7506b1.json",
      "package_label": "operator_replay",
      "packet_class": "policy_response_packet",
      "receipt_id": "rcpt_8a3e24f3de7506b1",
      "replay_package_filename": "slice_07_replay_package_rcpt_8a3e24f3de7506b1.zip",
      "replay_package_path": "harness/exports/slice_07_replay_package_rcpt_8a3e24f3de7506b1.zip",
      "request_id": "req_6434ff84e7e891be",
      "result_kind": "success",
      "trace_id": "trace_a4510a5aaa47ee5c"
    },
    {
      "compatibility_posture": "compatible",
      "execution_mode": "live",
      "export_id": "exp_9275301050bcc8c0",
      "manifest_filename": "slice_07_export_manifest_rcpt_bb355d9c41e2ca11.json",
      "manifest_path": "harness/exports/slice_07_export_manifest_rcpt_bb355d9c41e2ca11.json",
      "package_label": "operator_replay",
      "packet_class": "search_assist_packet",
      "receipt_id": "rcpt_bb355d9c41e2ca11",
      "replay_package_filename": "slice_07_replay_package_rcpt_bb355d9c41e2ca11.zip",
      "replay_package_path": "harness/exports/slice_07_replay_package_rcpt_bb355d9c41e2ca11.zip",
      "request_id": "req_c17f4d20ebf9fa48",
      "result_kind": "success",
      "trace_id": "trace_46b53f0ac7d87d7c"
    },
    {
      "compatibility_posture": "compatible",
      "execution_mode": "live",
      "export_id": "exp_0a495bdc2cbe83e2",
      "manifest_filename": "slice_07_export_manifest_rcpt_d18e33cda28dc140.json",
      "manifest_path": "harness/exports/slice_07_export_manifest_rcpt_d18e33cda28dc140.json",
      "package_label": "operator_replay",
      "packet_class": "policy_response_packet",
      "receipt_id": "rcpt_d18e33cda28dc140",
      "replay_package_filename": "slice_07_replay_package_rcpt_d18e33cda28dc140.zip",
      "replay_package_path": "harness/exports/slice_07_replay_package_rcpt_d18e33cda28dc140.zip",
      "request_id": "req_60091c2a4cab3b5d",
      "result_kind": "safe_failure",
      "trace_id": "trace_bca86669607b23d1"
    },
    {
      "compatibility_posture": "compatible",
      "execution_mode": "replay",
      "export_id": "exp_f2435e946e3fdcd7",
      "manifest_filename": "slice_07_export_manifest_rcpt_e9c8c7122534668a.json",
      "manifest_path": "harness/exports/slice_07_export_manifest_rcpt_e9c8c7122534668a.json",
      "package_label": "operator_replay",
      "packet_class": "answer_packet",
      "receipt_id": "rcpt_e9c8c7122534668a",
      "replay_package_filename": "slice_07_replay_package_rcpt_e9c8c7122534668a.zip",
      "replay_package_path": "harness/exports/slice_07_replay_package_rcpt_e9c8c7122534668a.zip",
      "request_id": "req_8ef0dcf5925fbb9c",
      "result_kind": "success",
      "trace_id": "trace_cee4ebaabfd06c84"
    }
  ],
  "export_dir": "harness/exports",
  "schema_version": "1.0.0"
}
