{
  "bundle_count": 4,
  "entries": [
    {
      "compatibility_posture": "compatible",
      "execution_mode": "live",
      "export_id": "exp_f4fed8fe38fa02b8",
      "manifest_filename": "slice_07_export_manifest_rcpt_0990c0414b9fec53.json",
      "manifest_path": "harness/exports/slice_07_export_manifest_rcpt_0990c0414b9fec53.json",
      "package_label": "operator_replay",
      "packet_class": "search_assist_packet",
      "receipt_id": "rcpt_0990c0414b9fec53",
      "replay_package_filename": "slice_07_replay_package_rcpt_0990c0414b9fec53.zip",
      "replay_package_path": "harness/exports/slice_07_replay_package_rcpt_0990c0414b9fec53.zip",
      "request_id": "req_c17f4d20ebf9fa48",
      "result_kind": "success",
      "trace_id": "trace_c35f5f7cc1de9224"
    },
    {
      "compatibility_posture": "compatible",
      "execution_mode": "live",
      "export_id": "exp_8d4e7850c0759740",
      "manifest_filename": "slice_07_export_manifest_rcpt_1ae7ddadb1e68689.json",
      "manifest_path": "harness/exports/slice_07_export_manifest_rcpt_1ae7ddadb1e68689.json",
      "package_label": "operator_replay",
      "packet_class": "policy_response_packet",
      "receipt_id": "rcpt_1ae7ddadb1e68689",
      "replay_package_filename": "slice_07_replay_package_rcpt_1ae7ddadb1e68689.zip",
      "replay_package_path": "harness/exports/slice_07_replay_package_rcpt_1ae7ddadb1e68689.zip",
      "request_id": "req_60091c2a4cab3b5d",
      "result_kind": "safe_failure",
      "trace_id": "trace_aefb8c1321bdfc65"
    },
    {
      "compatibility_posture": "compatible",
      "execution_mode": "live",
      "export_id": "exp_9bc203b69e9b9ec6",
      "manifest_filename": "slice_07_export_manifest_rcpt_83c93bd52dc41068.json",
      "manifest_path": "harness/exports/slice_07_export_manifest_rcpt_83c93bd52dc41068.json",
      "package_label": "operator_replay",
      "packet_class": "policy_response_packet",
      "receipt_id": "rcpt_83c93bd52dc41068",
      "replay_package_filename": "slice_07_replay_package_rcpt_83c93bd52dc41068.zip",
      "replay_package_path": "harness/exports/slice_07_replay_package_rcpt_83c93bd52dc41068.zip",
      "request_id": "req_6434ff84e7e891be",
      "result_kind": "success",
      "trace_id": "trace_fd2e99c9e3ac6ad3"
    },
    {
      "compatibility_posture": "compatible",
      "execution_mode": "replay",
      "export_id": "exp_10e5eeaf9bb7ceb6",
      "manifest_filename": "slice_07_export_manifest_rcpt_c9d30156e36fd002.json",
      "manifest_path": "harness/exports/slice_07_export_manifest_rcpt_c9d30156e36fd002.json",
      "package_label": "operator_replay",
      "packet_class": "answer_packet",
      "receipt_id": "rcpt_c9d30156e36fd002",
      "replay_package_filename": "slice_07_replay_package_rcpt_c9d30156e36fd002.zip",
      "replay_package_path": "harness/exports/slice_07_replay_package_rcpt_c9d30156e36fd002.zip",
      "request_id": "req_8ef0dcf5925fbb9c",
      "result_kind": "success",
      "trace_id": "trace_3558d79acfc22daa"
    }
  ],
  "export_dir": "harness/exports",
  "schema_version": "1.0.0"
}
